review_content,review_rating,raw_cooking_surface,overall_cooking_surface,cooking_surface_opinion,cooking_surface,raw_portability,overall_portability,portability_opinion,portability,raw_heat_control,overall_heat_control,heat_control_opinion,heat_control,raw_durability,overall_durability,durability_opinion,durability,raw_accessories,overall_accessories,accessories_opinion,accessories
Right Side Burner Won’t Light: Brand new. Right side burner won’t light with igniter. It does light manually. Igniter wire looks like it is in the correct position from burner tube.[Rating - 3/5],3,"1. The overall review is NEGATIVE.
2. The reviewer mentions that the right side burner won't light with the igniter, but does light manually.
3. The reviewer's opinion on the cooking_surface is NOT MENTIONED.",NEGATIVE,"The reviewer mentions that the right side burner won't light with the igniter, but does light manually.",NOT MENTIONED,"1. The overall review is NEGATIVE.
2. The reviewer does not mention anything about portability.
3. Since the reviewer did not mention anything about portability, the sentiment on portability is NOT MENTIONED.",NEGATIVE,The reviewer does not mention anything about portability.,NOT MENTIONED,"1. The overall review is NEGATIVE.
2. The reviewer mentions that the right side burner won't light with the igniter, but it does light manually.
3. The reviewer's opinion on the heat_control is NOT MENTIONED.",NEGATIVE,"The reviewer mentions that the right side burner won't light with the igniter, but it does light manually.",NOT MENTIONED,"1. The overall review is NEGATIVE.
2. The reviewer mentions that the right side burner won't light with the igniter, but does light manually. 
3. The reviewer's opinion on durability is NOT MENTIONED.",NEGATIVE,"The reviewer mentions that the right side burner won't light with the igniter, but does light manually. ",NOT MENTIONED,"1. The overall review is NEGATIVE.
2. The reviewer does not mention any accessories in the review.
3. The reviewer's opinion on the accessories is NOT MENTIONED.",NEGATIVE,The reviewer does not mention any accessories in the review.,NOT MENTIONED
Installation: Thumb screws used to secure stabilizing shelf were shipped incorrectly.  Larger of the two screws wasn’t in packaging.  Only received the two medium screws.   The griddle top looks discolored straight out the package.[Rating - 3/5],3,"1. The overall review is NEGATIVE.
2. The reviewer mentions that the griddle top looks discolored straight out of the package.
3. Sentiment on cooking_surface is NEGATIVE.",NEGATIVE,The reviewer mentions that the griddle top looks discolored straight out of the package.,NEGATIVE,"1. The overall review is NEGATIVE
2. The reviewer mentions that the stabilizing shelf was shipped incorrectly and that the griddle top looks discolored straight out of the package.
3. The reviewer's opinion on the portability is NOT MENTIONED.",NEGATIVE,The reviewer mentions that the stabilizing shelf was shipped incorrectly and that the griddle top looks discolored straight out of the package.,NOT MENTIONED,"1. The overall review is NEGATIVE.
2. The reviewer does not specifically mention the heat_control aspect of the product.
3. The sentiment on heat_control is NOT MENTIONED.",NEGATIVE,The reviewer does not specifically mention the heat_control aspect of the product.,NOT MENTIONED,"1. The overall review is NEGATIVE.
2. The reviewer mentions the issue with the thumb screws used to secure the stabilizing shelf and the discoloration of the griddle top.
3. The reviewer's opinion on durability is NEGATIVE.",NEGATIVE,The reviewer mentions the issue with the thumb screws used to secure the stabilizing shelf and the discoloration of the griddle top.,NEGATIVE,"1. The overall review is NEGATIVE.
2. The reviewer mentions that the thumb screws used to secure the stabilizing shelf were shipped incorrectly and that the larger screw was missing from the packaging. They also mention that the griddle top looks discolored straight out of the package.
3. The reviewer's opinion on the accessories is NEGATIVE as they had issues with the thumb screws and the appearance of the griddle top.",NEGATIVE,The reviewer mentions that the thumb screws used to secure the stabilizing shelf were shipped incorrectly and that the larger screw was missing from the packaging. They also mention that the griddle top looks discolored straight out of the package.,NEGATIVE
"Nice and solid: While I haven't used it yet, the grill is a good and solid product. Easy to put together as a number of pieces are pre-assembled.[Rating - 4/5]",4,"1. The overall review is POSITIVE
2. The reviewer mentions that the grill is a good and solid product.
3. Sentiment on cooking_surface is NOT MENTIONED",POSITIVE,The reviewer mentions that the grill is a good and solid product.,NOT MENTIONED,"1. The overall review is POSITIVE
2. The reviewer mentions that the grill is easy to put together and that a number of pieces are pre-assembled.
3. The reviewer's opinion on portability is POSITIVE.",POSITIVE,The reviewer mentions that the grill is easy to put together and that a number of pieces are pre-assembled.,POSITIVE,"1. The overall review is POSITIVE
2. The reviewer mentions that they haven't used the grill yet, so they do not specifically talk about the heat_control aspect.
3. The reviewer does not mention their opinion on the heat_control aspect.",POSITIVE,"The reviewer mentions that they haven't used the grill yet, so they do not specifically talk about the heat_control aspect.",NOT MENTIONED,"1. The overall review is POSITIVE
2. The reviewer mentions that the grill is a good and solid product.
3. The reviewer's opinion on durability is POSITIVE",POSITIVE,The reviewer mentions that the grill is a good and solid product.,POSITIVE,"1. The overall review is POSITIVE.
2. The reviewer mentions that the grill is easy to put together and that a number of pieces are pre-assembled.
3. The reviewer does not mention any specific accessories, so the sentiment on accessories is NOT MENTIONED.",POSITIVE,The reviewer mentions that the grill is easy to put together and that a number of pieces are pre-assembled.,NOT MENTIONED
"New Blackstone Griller!: Just seasoned it and looks good. I have a couple of the corners that will eventually fill in. Other than, let’s get cooking. Happy so far.[Rating - 5/5]",5,"1. The overall review is POSITIVE
2. The reviewer mentions that they have seasoned the grill and that it looks good. They also mention that a couple of corners will eventually fill in.
3. The reviewer's opinion on the cooking_surface is NOT MENTIONED",POSITIVE,The reviewer mentions that they have seasoned the grill and that it looks good. They also mention that a couple of corners will eventually fill in.,NOT MENTIONED,"1. The overall review is POSITIVE
2. The reviewer does not specifically mention portability in the review.
3. Sentiment on portability is NOT MENTIONED",POSITIVE,The reviewer does not specifically mention portability in the review.,NOT MENTIONED,"1. The overall review is POSITIVE
2. The reviewer mentions that they have seasoned the griller and that a couple of corners will eventually fill in.
3. The reviewer's opinion on the heat_control is NOT MENTIONED.",POSITIVE,The reviewer mentions that they have seasoned the griller and that a couple of corners will eventually fill in.,NOT MENTIONED,"1. The overall review is POSITIVE
2. The reviewer mentions that they have seasoned the griller and that a couple of corners will eventually fill in.
3. The reviewer's opinion on durability is POSITIVE.",POSITIVE,The reviewer mentions that they have seasoned the griller and that a couple of corners will eventually fill in.,POSITIVE,"1. The overall review is POSITIVE.
2. The reviewer mentions that they have seasoned the griller and that a couple of corners will eventually fill in.
3. The reviewer does not specifically mention any accessories, so the sentiment on accessories is NOT MENTIONED.",POSITIVE,The reviewer mentions that they have seasoned the griller and that a couple of corners will eventually fill in.,NOT MENTIONED
Awesome: Didnt realize how much better cooking on this griddle was compaired to the old style grills[Rating - 4/5],4,"1. The overall review is POSITIVE
2. The reviewer talks about how much better cooking on this griddle is compared to old style grills.
3. Sentiment on cooking_surface is POSITIVE",POSITIVE,The reviewer talks about how much better cooking on this griddle is compared to old style grills.,POSITIVE,"1. The overall review is POSITIVE.
2. The reviewer mentions that they didn't realize how much better cooking on this griddle was compared to old style grills.
3. The reviewer does not mention anything about the portability of the griddle, so the sentiment on portability is NOT MENTIONED.",POSITIVE,The reviewer mentions that they didn't realize how much better cooking on this griddle was compared to old style grills.,NOT MENTIONED,"1. The overall review is POSITIVE
2. The reviewer mentions that they didn't realize how much better cooking on this griddle was compared to old style grills.
3. The reviewer's opinion on the heat_control is POSITIVE.",POSITIVE,The reviewer mentions that they didn't realize how much better cooking on this griddle was compared to old style grills.,POSITIVE,"1. The overall review is POSITIVE
2. The reviewer mentions that they didn't realize how much better cooking on this griddle was compared to old style grills.
3. The reviewer's opinion on durability is POSITIVE.",POSITIVE,The reviewer mentions that they didn't realize how much better cooking on this griddle was compared to old style grills.,POSITIVE,"1. The overall review is POSITIVE
2. The reviewer mentions that they didn't realize how much better cooking on this griddle was compared to old style grills.
3. The reviewer's opinion on the accessories is NOT MENTIONED.",POSITIVE,The reviewer mentions that they didn't realize how much better cooking on this griddle was compared to old style grills.,NOT MENTIONED
Great product: I’ve only had it a couple weeks but it works great. First use was cooking bacon. A little sticking even after conditioning but not enough to worry about. My son said the bacon was more savory than usual![Rating - 4/5],4,"1. The overall review is POSITIVE
2. The reviewer talks about the cooking surface being used to cook bacon.
3. Sentiment on cooking_surface is NEUTRAL",POSITIVE,The reviewer talks about the cooking surface being used to cook bacon.,NEUTRAL,"1. The overall review is POSITIVE.
2. The reviewer does not mention anything about the portability of the griddle.
3. The sentiment on portability is NOT MENTIONED.",POSITIVE,The reviewer does not mention anything about the portability of the griddle.,NOT MENTIONED,"1. The overall review is POSITIVE
2. The reviewer mentions that there was a little sticking even after conditioning.
3. The reviewer's opinion on the heat_control is NEUTRAL",POSITIVE,The reviewer mentions that there was a little sticking even after conditioning.,NEUTRAL,"1. The overall review is POSITIVE
2. The reviewer mentions that there was a little sticking even after conditioning.
3. The reviewer's opinion on durability is NEUTRAL",POSITIVE,The reviewer mentions that there was a little sticking even after conditioning.,NEUTRAL,"1. The overall review is POSITIVE.
2. The reviewer does not mention any accessories in the review.
3. The sentiment on accessories is NOT MENTIONED.",POSITIVE,The reviewer does not mention any accessories in the review.,NOT MENTIONED
"Great: Looking forward to learning more about how to cook with this, so far so good![Rating - 5/5]",5,"1. The overall review is POSITIVE
2. The reviewer mentions that they are looking forward to learning more about how to cook with the product.
3. The reviewer's opinion on the cooking_surface is NOT MENTIONED.",POSITIVE,The reviewer mentions that they are looking forward to learning more about how to cook with the product.,NOT MENTIONED,"1. The overall review is POSITIVE.
2. The reviewer does not specifically mention portability in the review.
3. Sentiment on portability is NOT MENTIONED.",POSITIVE,The reviewer does not specifically mention portability in the review.,NOT MENTIONED,"1. The overall review is POSITIVE
2. The reviewer mentions that they are looking forward to learning more about how to cook with the product.
3. The reviewer's opinion on the heat_control is NOT MENTIONED",POSITIVE,The reviewer mentions that they are looking forward to learning more about how to cook with the product.,NOT MENTIONED,"1. The overall review is POSITIVE
2. The reviewer mentions that they are looking forward to learning more about how to cook with the griddle.
3. The reviewer does not specifically mention the durability of the griddle, so the sentiment on durability is NOT MENTIONED.",POSITIVE,The reviewer mentions that they are looking forward to learning more about how to cook with the griddle.,NOT MENTIONED,"1. The overall review is POSITIVE.
2. The reviewer mentions that they are looking forward to learning more about how to cook with the griddle.
3. The reviewer's opinion on the accessories is NOT MENTIONED.",POSITIVE,The reviewer mentions that they are looking forward to learning more about how to cook with the griddle.,NOT MENTIONED
Husband Loves: Early Fathers Day and Birthday gift for the hubby. Beautiful and so easy to build![Rating - 5/5],5,"1. The overall review is POSITIVE
2. The reviewer mentions that the product is easy to build.
3. Sentiment on cooking_surface is NOT MENTIONED",POSITIVE,The reviewer mentions that the product is easy to build.,NOT MENTIONED,"1. The overall review is POSITIVE.
2. The reviewer mentions that the griddle is ""so easy to build.""
3. The reviewer's opinion on the portability is POSITIVE.",POSITIVE,"The reviewer mentions that the griddle is ""so easy to build.""",POSITIVE,"1. The overall review is POSITIVE
2. The reviewer does not specifically mention the heat_control aspect in the review.
3. Sentiment on heat_control is NOT MENTIONED",POSITIVE,The reviewer does not specifically mention the heat_control aspect in the review.,NOT MENTIONED,"1. The overall review is POSITIVE
2. The reviewer mentions that the griddle is ""Beautiful and so easy to build!""
3. The reviewer's opinion on the durability is NOT MENTIONED",POSITIVE,"The reviewer mentions that the griddle is ""Beautiful and so easy to build!""",NOT MENTIONED,"1. The overall review is POSITIVE.
2. The reviewer mentions that the griddle is ""Beautiful and so easy to build.""
3. The reviewer does not mention any specific accessories, so the sentiment on accessories is NOT MENTIONED.",POSITIVE,"The reviewer mentions that the griddle is ""Beautiful and so easy to build.""",NOT MENTIONED
New owner: Looking forward to trying the black stone out very easy to assemble and good instructions[Rating - 5/5],5,"1. The overall review is POSITIVE
2. The reviewer mentions that they are looking forward to trying out the black stone, which likely refers to the cooking surface of the product.
3. Sentiment on cooking_surface is POSITIVE",POSITIVE,"The reviewer mentions that they are looking forward to trying out the black stone, which likely refers to the cooking surface of the product.",POSITIVE,"1. The overall review is POSITIVE.
2. The reviewer mentions that the black stone griddle is ""very easy to assemble.""
3. The reviewer's opinion on portability is POSITIVE.",POSITIVE,"The reviewer mentions that the black stone griddle is ""very easy to assemble.""",POSITIVE,"1. The overall review is POSITIVE
2. The reviewer mentions that they are looking forward to trying out the black stone, which implies they are excited about using it for cooking.
3. The reviewer does not specifically mention the heat_control aspect, so it is NOT MENTIONED.",POSITIVE,"The reviewer mentions that they are looking forward to trying out the black stone, which implies they are excited about using it for cooking.",NOT MENTIONED,"1. The overall review is POSITIVE
2. The reviewer mentions that the black stone griddle is ""very easy to assemble"" and that it comes with ""good instructions.""
3. The reviewer does not specifically mention durability, so the sentiment on durability is NOT MENTIONED.",POSITIVE,"The reviewer mentions that the black stone griddle is ""very easy to assemble"" and that it comes with ""good instructions.""",NOT MENTIONED,"1. The overall review is POSITIVE
2. The reviewer mentions that the black stone comes with good instructions.
3. The reviewer's opinion on the accessories is NOT MENTIONED.",POSITIVE,The reviewer mentions that the black stone comes with good instructions.,NOT MENTIONED
Incorrect knob: We were able to use our new grill but come to find out that the company sent us an incorrect knob which doesn’t allow us to use both sides of the grill[Rating - 1/5],1,"1. The overall review is NEGATIVE
2. The reviewer mentions that the incorrect knob sent by the company doesn't allow them to use both sides of the grill.
3. Sentiment on cooking_surface is NEGATIVE",NEGATIVE,The reviewer mentions that the incorrect knob sent by the company doesn't allow them to use both sides of the grill.,NEGATIVE,"1. The overall review is NEGATIVE.
2. The reviewer does not specifically mention portability in the review.
3. The sentiment on portability is NOT MENTIONED.",NEGATIVE,The reviewer does not specifically mention portability in the review.,NOT MENTIONED,"1. The overall review is NEGATIVE
2. The reviewer mentions that they were sent an incorrect knob which doesn't allow them to use both sides of the grill.
3. Sentiment on heat_control is NEGATIVE",NEGATIVE,The reviewer mentions that they were sent an incorrect knob which doesn't allow them to use both sides of the grill.,NEGATIVE,"1. The overall review is NEGATIVE.
2. The reviewer mentions that the company sent an incorrect knob which doesn't allow them to use both sides of the grill.
3. The reviewer's opinion on durability is NOT MENTIONED.",NEGATIVE,The reviewer mentions that the company sent an incorrect knob which doesn't allow them to use both sides of the grill.,NOT MENTIONED,"1. The overall review is NEGATIVE.
2. The reviewer mentions that the company sent an incorrect knob which doesn't allow them to use both sides of the grill.
3. The reviewer's opinion on the accessories is NEGATIVE.",NEGATIVE,The reviewer mentions that the company sent an incorrect knob which doesn't allow them to use both sides of the grill.,NEGATIVE
"Unboxing now!: I’ve been so excited to get a blackstone for years now, can’t wait to griddle it up! Already prepped the first meal, now to assemble and season![Rating - 5/5]",5,"1. The overall review is POSITIVE
2. The reviewer mentions that they are excited to get a blackstone for griddling and have already prepped their first meal.
3. Sentiment on cooking_surface is POSITIVE",POSITIVE,The reviewer mentions that they are excited to get a blackstone for griddling and have already prepped their first meal.,POSITIVE,"1. The overall review is POSITIVE.
2. The reviewer does not specifically mention portability in the review.
3. Sentiment on portability is NOT MENTIONED.",POSITIVE,The reviewer does not specifically mention portability in the review.,NOT MENTIONED,"1. The overall review is POSITIVE.
2. The reviewer mentions that they are excited to finally get a blackstone griddle and are looking forward to griddling up their first meal.
3. The reviewer does not specifically mention the heat_control aspect of the product, so it is NOT MENTIONED.",POSITIVE,The reviewer mentions that they are excited to finally get a blackstone griddle and are looking forward to griddling up their first meal.,NOT MENTIONED,"1. The overall review is POSITIVE.
2. The reviewer mentions assembling and seasoning the griddle, which indirectly implies that they are interacting with the product and potentially assessing its durability.
3. The reviewer's opinion on durability is NOT MENTIONED.",POSITIVE,"The reviewer mentions assembling and seasoning the griddle, which indirectly implies that they are interacting with the product and potentially assessing its durability.",NOT MENTIONED,"1. The overall review is POSITIVE
2. The reviewer mentions that they are excited to unbox the blackstone griddle and can't wait to assemble and season it.
3. The reviewer does not specifically mention the accessories, so it is NOT MENTIONED.",POSITIVE,The reviewer mentions that they are excited to unbox the blackstone griddle and can't wait to assemble and season it.,NOT MENTIONED
Backyard Griddle: I’m giving this griddle 5 stars in hopes it lives up to our high expectations!  We just bought a new home and love our backyard.  This is a brand new addition to our home.[Rating - 5/5],5,"1. The overall review is POSITIVE.
2. The reviewer mentions that the griddle is a brand new addition to their home.
3. The reviewer's opinion on the cooking_surface is NOT MENTIONED.",POSITIVE,The reviewer mentions that the griddle is a brand new addition to their home.,NOT MENTIONED,"1. The overall review is POSITIVE.
2. The reviewer mentions that they just bought a new home and love their backyard, and that the griddle is a brand new addition to their home.
3. The reviewer does not mention anything specific about the portability of the griddle, so the sentiment on portability is NOT MENTIONED.",POSITIVE,"The reviewer mentions that they just bought a new home and love their backyard, and that the griddle is a brand new addition to their home.",NOT MENTIONED,"1. The overall review is POSITIVE.
2. The reviewer mentions that they are giving the griddle 5 stars in hopes that it lives up to their high expectations.
3. The reviewer does not specifically mention the heat_control aspect of the griddle, so the sentiment on heat_control is NOT MENTIONED.",POSITIVE,The reviewer mentions that they are giving the griddle 5 stars in hopes that it lives up to their high expectations.,NOT MENTIONED,"1. The overall review is POSITIVE.
2. The reviewer mentions that the griddle is a brand new addition to their home.
3. The reviewer's opinion on the durability is NOT MENTIONED.",POSITIVE,The reviewer mentions that the griddle is a brand new addition to their home.,NOT MENTIONED,"1. The overall review is POSITIVE.
2. The reviewer mentions that the griddle is a brand new addition to their home.
3. The reviewer does not mention any specific accessories, so the sentiment on accessories is NOT MENTIONED.",POSITIVE,The reviewer mentions that the griddle is a brand new addition to their home.,NOT MENTIONED
New user: Haven't tried it yet. I had to fill out a review so I could close the registration page. I'll review it after I get a chance to use it.[Rating - 5/5],5,"1. The overall review is NEUTRAL.
2. The reviewer did not mention anything specific about the cooking_surface.
3. The sentiment on cooking_surface is NOT MENTIONED.",NEUTRAL,The reviewer did not mention anything specific about the cooking_surface.,NOT MENTIONED,"1. The overall review is NEUTRAL.
2. The reviewer mentions that they haven't tried the product yet, so they do not provide any specific details about the portability.
3. The reviewer does not provide an opinion on the portability as they have not used the product yet. Therefore, the sentiment on portability is NOT MENTIONED.",NEUTRAL,"The reviewer mentions that they haven't tried the product yet, so they do not provide any specific details about the portability.",NOT MENTIONED,"1. The overall review is NEUTRAL.
2. The reviewer did not mention anything specific about the heat_control.
3. The sentiment on heat_control is NOT MENTIONED.",NEUTRAL,The reviewer did not mention anything specific about the heat_control.,NOT MENTIONED,"1. The overall review is NEUTRAL.
2. The reviewer did not mention anything specific about the durability of the product.
3. The reviewer did not provide an opinion on the durability. Sentiment on durability is NOT MENTIONED.",NEUTRAL,The reviewer did not mention anything specific about the durability of the product.,NOT MENTIONED,"1. The overall review is NEUTRAL.
2. The reviewer mentions that they haven't tried the product yet and had to fill out a review to close the registration page.
3. The reviewer does not mention anything about the accessories, so the sentiment on accessories is NOT MENTIONED.",NEUTRAL,The reviewer mentions that they haven't tried the product yet and had to fill out a review to close the registration page.,NOT MENTIONED
